GEO.id,GEO.id2,GEO.display-label,HC01_EST_VC01,HC01_MOE_VC01,HC02_EST_VC01,HC02_MOE_VC01,HC03_EST_VC01,HC03_MOE_VC01,HC01_EST_VC03,HC01_MOE_VC03,HC02_EST_VC03,HC02_MOE_VC03,HC03_EST_VC03,HC03_MOE_VC03,HC01_EST_VC04,HC01_MOE_VC04,HC02_EST_VC04,HC02_MOE_VC04,HC03_EST_VC04,HC03_MOE_VC04,HC01_EST_VC05,HC01_MOE_VC05,HC02_EST_VC05,HC02_MOE_VC05,HC03_EST_VC05,HC03_MOE_VC05,HC01_EST_VC06,HC01_MOE_VC06,HC02_EST_VC06,HC02_MOE_VC06,HC03_EST_VC06,HC03_MOE_VC06,HC01_EST_VC07,HC01_MOE_VC07,HC02_EST_VC07,HC02_MOE_VC07,HC03_EST_VC07,HC03_MOE_VC07,HC01_EST_VC08,HC01_MOE_VC08,HC02_EST_VC08,HC02_MOE_VC08,HC03_EST_VC08,HC03_MOE_VC08,HC01_EST_VC09,HC01_MOE_VC09,HC02_EST_VC09,HC02_MOE_VC09,HC03_EST_VC09,HC03_MOE_VC09,HC01_EST_VC10,HC01_MOE_VC10,HC02_EST_VC10,HC02_MOE_VC10,HC03_EST_VC10,HC03_MOE_VC10,HC01_EST_VC11,HC01_MOE_VC11,HC02_EST_VC11,HC02_MOE_VC11,HC03_EST_VC11,HC03_MOE_VC11,HC01_EST_VC12,HC01_MOE_VC12,HC02_EST_VC12,HC02_MOE_VC12,HC03_EST_VC12,HC03_MOE_VC12,HC01_EST_VC13,HC01_MOE_VC13,HC02_EST_VC13,HC02_MOE_VC13,HC03_EST_VC13,HC03_MOE_VC13,HC01_EST_VC14,HC01_MOE_VC14,HC02_EST_VC14,HC02_MOE_VC14,HC03_EST_VC14,HC03_MOE_VC14,HC01_EST_VC15,HC01_MOE_VC15,HC02_EST_VC15,HC02_MOE_VC15,HC03_EST_VC15,HC03_MOE_VC15,HC01_EST_VC16,HC01_MOE_VC16,HC02_EST_VC16,HC02_MOE_VC16,HC03_EST_VC16,HC03_MOE_VC16,HC01_EST_VC17,HC01_MOE_VC17,HC02_EST_VC17,HC02_MOE_VC17,HC03_EST_VC17,HC03_MOE_VC17,HC01_EST_VC18,HC01_MOE_VC18,HC02_EST_VC18,HC02_MOE_VC18,HC03_EST_VC18,HC03_MOE_VC18,HC01_EST_VC19,HC01_MOE_VC19,HC02_EST_VC19,HC02_MOE_VC19,HC03_EST_VC19,HC03_MOE_VC19,HC01_EST_VC20,HC01_MOE_VC20,HC02_EST_VC20,HC02_MOE_VC20,HC03_EST_VC20,HC03_MOE_VC20,HC01_EST_VC22,HC01_MOE_VC22,HC02_EST_VC22,HC02_MOE_VC22,HC03_EST_VC22,HC03_MOE_VC22,HC01_EST_VC23,HC01_MOE_VC23,HC02_EST_VC23,HC02_MOE_VC23,HC03_EST_VC23,HC03_MOE_VC23,HC01_EST_VC24,HC01_MOE_VC24,HC02_EST_VC24,HC02_MOE_VC24,HC03_EST_VC24,HC03_MOE_VC24,HC01_EST_VC25,HC01_MOE_VC25,HC02_EST_VC25,HC02_MOE_VC25,HC03_EST_VC25,HC03_MOE_VC25,HC01_EST_VC26,HC01_MOE_VC26,HC02_EST_VC26,HC02_MOE_VC26,HC03_EST_VC26,HC03_MOE_VC26,HC01_EST_VC27,HC01_MOE_VC27,HC02_EST_VC27,HC02_MOE_VC27,HC03_EST_VC27,HC03_MOE_VC27,HC01_EST_VC28,HC01_MOE_VC28,HC02_EST_VC28,HC02_MOE_VC28,HC03_EST_VC28,HC03_MOE_VC28,HC01_EST_VC29,HC01_MOE_VC29,HC02_EST_VC29,HC02_MOE_VC29,HC03_EST_VC29,HC03_MOE_VC29,HC01_EST_VC30,HC01_MOE_VC30,HC02_EST_VC30,HC02_MOE_VC30,HC03_EST_VC30,HC03_MOE_VC30,HC01_EST_VC31,HC01_MOE_VC31,HC02_EST_VC31,HC02_MOE_VC31,HC03_EST_VC31,HC03_MOE_VC31,HC01_EST_VC33,HC01_MOE_VC33,HC02_EST_VC33,HC02_MOE_VC33,HC03_EST_VC33,HC03_MOE_VC33,HC01_EST_VC34,HC01_MOE_VC34,HC02_EST_VC34,HC02_MOE_VC34,HC03_EST_VC34,HC03_MOE_VC34,HC01_EST_VC35,HC01_MOE_VC35,HC02_EST_VC35,HC02_MOE_VC35,HC03_EST_VC35,HC03_MOE_VC35,HC01_EST_VC36,HC01_MOE_VC36,HC02_EST_VC36,HC02_MOE_VC36,HC03_EST_VC36,HC03_MOE_VC36,HC01_EST_VC37,HC01_MOE_VC37,HC02_EST_VC37,HC02_MOE_VC37,HC03_EST_VC37,HC03_MOE_VC37,HC01_EST_VC39,HC01_MOE_VC39,HC02_EST_VC39,HC02_MOE_VC39,HC03_EST_VC39,HC03_MOE_VC39,HC01_EST_VC40,HC01_MOE_VC40,HC02_EST_VC40,HC02_MOE_VC40,HC03_EST_VC40,HC03_MOE_VC40
Id,Id2,Geography,Total; Estimate; Total population,Total; Margin of Error; Total population,Male; Estimate; Total population,Male; Margin of Error; Total population,Female; Estimate; Total population,Female; Margin of Error; Total population,Total; Estimate; Total population - AGE - Under 5 years,Total; Margin of Error; Total population - AGE - Under 5 years,Male; Estimate; Total population - AGE - Under 5 years,Male; Margin of Error; Total population - AGE - Under 5 years,Female; Estimate; Total population - AGE - Under 5 years,Female; Margin of Error; Total population - AGE - Under 5 years,Total; Estimate; Total population - AGE - 5 to 9 years,Total; Margin of Error; Total population - AGE - 5 to 9 years,Male; Estimate; Total population - AGE - 5 to 9 years,Male; Margin of Error; Total population - AGE - 5 to 9 years,Female; Estimate; Total population - AGE - 5 to 9 years,Female; Margin of Error; Total population - AGE - 5 to 9 years,Total; Estimate; Total population - AGE - 10 to 14 years,Total; Margin of Error; Total population - AGE - 10 to 14 years,Male; Estimate; Total population - AGE - 10 to 14 years,Male; Margin of Error; Total population - AGE - 10 to 14 years,Female; Estimate; Total population - AGE - 10 to 14 years,Female; Margin of Error; Total population - AGE - 10 to 14 years,Total; Estimate; Total population - AGE - 15 to 19 years,Total; Margin of Error; Total population - AGE - 15 to 19 years,Male; Estimate; Total population - AGE - 15 to 19 years,Male; Margin of Error; Total population - AGE - 15 to 19 years,Female; Estimate; Total population - AGE - 15 to 19 years,Female; Margin of Error; Total population - AGE - 15 to 19 years,Total; Estimate; Total population - AGE - 20 to 24 years,Total; Margin of Error; Total population - AGE - 20 to 24 years,Male; Estimate; Total population - AGE - 20 to 24 years,Male; Margin of Error; Total population - AGE - 20 to 24 years,Female; Estimate; Total population - AGE - 20 to 24 years,Female; Margin of Error; Total population - AGE - 20 to 24 years,Total; Estimate; Total population - AGE - 25 to 29 years,Total; Margin of Error; Total population - AGE - 25 to 29 years,Male; Estimate; Total population - AGE - 25 to 29 years,Male; Margin of Error; Total population - AGE - 25 to 29 years,Female; Estimate; Total population - AGE - 25 to 29 years,Female; Margin of Error; Total population - AGE - 25 to 29 years,Total; Estimate; Total population - AGE - 30 to 34 years,Total; Margin of Error; Total population - AGE - 30 to 34 years,Male; Estimate; Total population - AGE - 30 to 34 years,Male; Margin of Error; Total population - AGE - 30 to 34 years,Female; Estimate; Total population - AGE - 30 to 34 years,Female; Margin of Error; Total population - AGE - 30 to 34 years,Total; Estimate; Total population - AGE - 35 to 39 years,Total; Margin of Error; Total population - AGE - 35 to 39 years,Male; Estimate; Total population - AGE - 35 to 39 years,Male; Margin of Error; Total population - AGE - 35 to 39 years,Female; Estimate; Total population - AGE - 35 to 39 years,Female; Margin of Error; Total population - AGE - 35 to 39 years,Total; Estimate; Total population - AGE - 40 to 44 years,Total; Margin of Error; Total population - AGE - 40 to 44 years,Male; Estimate; Total population - AGE - 40 to 44 years,Male; Margin of Error; Total population - AGE - 40 to 44 years,Female; Estimate; Total population - AGE - 40 to 44 years,Female; Margin of Error; Total population - AGE - 40 to 44 years,Total; Estimate; Total population - AGE - 45 to 49 years,Total; Margin of Error; Total population - AGE - 45 to 49 years,Male; Estimate; Total population - AGE - 45 to 49 years,Male; Margin of Error; Total population - AGE - 45 to 49 years,Female; Estimate; Total population - AGE - 45 to 49 years,Female; Margin of Error; Total population - AGE - 45 to 49 years,Total; Estimate; Total population - AGE - 50 to 54 years,Total; Margin of Error; Total population - AGE - 50 to 54 years,Male; Estimate; Total population - AGE - 50 to 54 years,Male; Margin of Error; Total population - AGE - 50 to 54 years,Female; Estimate; Total population - AGE - 50 to 54 years,Female; Margin of Error; Total population - AGE - 50 to 54 years,Total; Estimate; Total population - AGE - 55 to 59 years,Total; Margin of Error; Total population - AGE - 55 to 59 years,Male; Estimate; Total population - AGE - 55 to 59 years,Male; Margin of Error; Total population - AGE - 55 to 59 years,Female; Estimate; Total population - AGE - 55 to 59 years,Female; Margin of Error; Total population - AGE - 55 to 59 years,Total; Estimate; Total population - AGE - 60 to 64 years,Total; Margin of Error; Total population - AGE - 60 to 64 years,Male; Estimate; Total population - AGE - 60 to 64 years,Male; Margin of Error; Total population - AGE - 60 to 64 years,Female; Estimate; Total population - AGE - 60 to 64 years,Female; Margin of Error; Total population - AGE - 60 to 64 years,Total; Estimate; Total population - AGE - 65 to 69 years,Total; Margin of Error; Total population - AGE - 65 to 69 years,Male; Estimate; Total population - AGE - 65 to 69 years,Male; Margin of Error; Total population - AGE - 65 to 69 years,Female; Estimate; Total population - AGE - 65 to 69 years,Female; Margin of Error; Total population - AGE - 65 to 69 years,Total; Estimate; Total population - AGE - 70 to 74 years,Total; Margin of Error; Total population - AGE - 70 to 74 years,Male; Estimate; Total population - AGE - 70 to 74 years,Male; Margin of Error; Total population - AGE - 70 to 74 years,Female; Estimate; Total population - AGE - 70 to 74 years,Female; Margin of Error; Total population - AGE - 70 to 74 years,Total; Estimate; Total population - AGE - 75 to 79 years,Total; Margin of Error; Total population - AGE - 75 to 79 years,Male; Estimate; Total population - AGE - 75 to 79 years,Male; Margin of Error; Total population - AGE - 75 to 79 years,Female; Estimate; Total population - AGE - 75 to 79 years,Female; Margin of Error; Total population - AGE - 75 to 79 years,Total; Estimate; Total population - AGE - 80 to 84 years,Total; Margin of Error; Total population - AGE - 80 to 84 years,Male; Estimate; Total population - AGE - 80 to 84 years,Male; Margin of Error; Total population - AGE - 80 to 84 years,Female; Estimate; Total population - AGE - 80 to 84 years,Female; Margin of Error; Total population - AGE - 80 to 84 years,Total; Estimate; Total population - AGE - 85 years and over,Total; Margin of Error; Total population - AGE - 85 years and over,Male; Estimate; Total population - AGE - 85 years and over,Male; Margin of Error; Total population - AGE - 85 years and over,Female; Estimate; Total population - AGE - 85 years and over,Female; Margin of Error; Total population - AGE - 85 years and over,Total; Estimate; Total population - SELECTED AGE CATEGORIES - 5 to 14 years,Total; Margin of Error; Total population - SELECTED AGE CATEGORIES - 5 to 14 years,Male; Estimate; Total population - SELECTED AGE CATEGORIES - 5 to 14 years,Male; Margin of Error; Total population - SELECTED AGE CATEGORIES - 5 to 14 years,Female; Estimate; Total population - SELECTED AGE CATEGORIES - 5 to 14 years,Female; Margin of Error; Total population - SELECTED AGE CATEGORIES - 5 to 14 years,Total; Estimate; Total population - SELECTED AGE CATEGORIES - 15 to 17 years,Total; Margin of Error; Total population - SELECTED AGE CATEGORIES - 15 to 17 years,Male; Estimate; Total population - SELECTED AGE CATEGORIES - 15 to 17 years,Male; Margin of Error; Total population - SELECTED AGE CATEGORIES - 15 to 17 years,Female; Estimate; Total population - SELECTED AGE CATEGORIES - 15 to 17 years,Female; Margin of Error; Total population - SELECTED AGE CATEGORIES - 15 to 17 years,Total; Estimate; Total population - SELECTED AGE CATEGORIES - 18 to 24 years,Total; Margin of Error; Total population - SELECTED AGE CATEGORIES - 18 to 24 years,Male; Estimate; Total population - SELECTED AGE CATEGORIES - 18 to 24 years,Male; Margin of Error; Total population - SELECTED AGE CATEGORIES - 18 to 24 years,Female; Estimate; Total population - SELECTED AGE CATEGORIES - 18 to 24 years,Female; Margin of Error; Total population - SELECTED AGE CATEGORIES - 18 to 24 years,Total; Estimate; Total population - SELECTED AGE CATEGORIES - 15 to 44 years,Total; Margin of Error; Total population - SELECTED AGE CATEGORIES - 15 to 44 years,Male; Estimate; Total population - SELECTED AGE CATEGORIES - 15 to 44 years,Male; Margin of Error; Total population - SELECTED AGE CATEGORIES - 15 to 44 years,Female; Estimate; Total population - SELECTED AGE CATEGORIES - 15 to 44 years,Female; Margin of Error; Total population - SELECTED AGE CATEGORIES - 15 to 44 years,Total; Estimate; Total population - SELECTED AGE CATEGORIES - 16 years and over,Total; Margin of Error; Total population - SELECTED AGE CATEGORIES - 16 years and over,Male; Estimate; Total population - SELECTED AGE CATEGORIES - 16 years and over,Male; Margin of Error; Total population - SELECTED AGE CATEGORIES - 16 years and over,Female; Estimate; Total population - SELECTED AGE CATEGORIES - 16 years and over,Female; Margin of Error; Total population - SELECTED AGE CATEGORIES - 16 years and over,Total; Estimate; Total population - SELECTED AGE CATEGORIES - 18 years and over,Total; Margin of Error; Total population - SELECTED AGE CATEGORIES - 18 years and over,Male; Estimate; Total population - SELECTED AGE CATEGORIES - 18 years and over,Male; Margin of Error; Total population - SELECTED AGE CATEGORIES - 18 years and over,Female; Estimate; Total population - SELECTED AGE CATEGORIES - 18 years and over,Female; Margin of Error; Total population - SELECTED AGE CATEGORIES - 18 years and over,Total; Estimate; Total population - SELECTED AGE CATEGORIES - 60 years and over,Total; Margin of Error; Total population - SELECTED AGE CATEGORIES - 60 years and over,Male; Estimate; Total population - SELECTED AGE CATEGORIES - 60 years and over,Male; Margin of Error; Total population - SELECTED AGE CATEGORIES - 60 years and over,Female; Estimate; Total population - SELECTED AGE CATEGORIES - 60 years and over,Female; Margin of Error; Total population - SELECTED AGE CATEGORIES - 60 years and over,Total; Estimate; Total population - SELECTED AGE CATEGORIES - 62 years and over,Total; Margin of Error; Total population - SELECTED AGE CATEGORIES - 62 years and over,Male; Estimate; Total population - SELECTED AGE CATEGORIES - 62 years and over,Male; Margin of Error; Total population - SELECTED AGE CATEGORIES - 62 years and over,Female; Estimate; Total population - SELECTED AGE CATEGORIES - 62 years and over,Female; Margin of Error; Total population - SELECTED AGE CATEGORIES - 62 years and over,Total; Estimate; Total population - SELECTED AGE CATEGORIES - 65 years and over,Total; Margin of Error; Total population - SELECTED AGE CATEGORIES - 65 years and over,Male; Estimate; Total population - SELECTED AGE CATEGORIES - 65 years and over,Male; Margin of Error; Total population - SELECTED AGE CATEGORIES - 65 years and over,Female; Estimate; Total population - SELECTED AGE CATEGORIES - 65 years and over,Female; Margin of Error; Total population - SELECTED AGE CATEGORIES - 65 years and over,Total; Estimate; Total population - SELECTED AGE CATEGORIES - 75 years and over,Total; Margin of Error; Total population - SELECTED AGE CATEGORIES - 75 years and over,Male; Estimate; Total population - SELECTED AGE CATEGORIES - 75 years and over,Male; Margin of Error; Total population - SELECTED AGE CATEGORIES - 75 years and over,Female; Estimate; Total population - SELECTED AGE CATEGORIES - 75 years and over,Female; Margin of Error; Total population - SELECTED AGE CATEGORIES - 75 years and over,Total; Estimate; Total population - SUMMARY INDICATORS - Median age (years),Total; Margin of Error; Total population - SUMMARY INDICATORS - Median age (years),Male; Estimate; Total population - SUMMARY INDICATORS - Median age (years),Male; Margin of Error; Total population - SUMMARY INDICATORS - Median age (years),Female; Estimate; Total population - SUMMARY INDICATORS - Median age (years),Female; Margin of Error; Total population - SUMMARY INDICATORS - Median age (years),Total; Estimate; Total population - SUMMARY INDICATORS - Sex ratio (males per 100 females),Total; Margin of Error; Total population - SUMMARY INDICATORS - Sex ratio (males per 100 females),Male; Estimate; Total population - SUMMARY INDICATORS - Sex ratio (males per 100 females),Male; Margin of Error; Total population - SUMMARY INDICATORS - Sex ratio (males per 100 females),Female; Estimate; Total population - SUMMARY INDICATORS - Sex ratio (males per 100 females),Female; Margin of Error; Total population - SUMMARY INDICATORS - Sex ratio (males per 100 females),Total; Estimate; Total population - SUMMARY INDICATORS - Age dependency ratio,Total; Margin of Error; Total population - SUMMARY INDICATORS - Age dependency ratio,Male; Estimate; Total population - SUMMARY INDICATORS - Age dependency ratio,Male; Margin of Error; Total population - SUMMARY INDICATORS - Age dependency ratio,Female; Estimate; Total population - SUMMARY INDICATORS - Age dependency ratio,Female; Margin of Error; Total population - SUMMARY INDICATORS - Age dependency ratio,Total; Estimate; Total population - SUMMARY INDICATORS - Old-age dependency ratio,Total; Margin of Error; Total population - SUMMARY INDICATORS - Old-age dependency ratio,Male; Estimate; Total population - SUMMARY INDICATORS - Old-age dependency ratio,Male; Margin of Error; Total population - SUMMARY INDICATORS - Old-age dependency ratio,Female; Estimate; Total population - SUMMARY INDICATORS - Old-age dependency ratio,Female; Margin of Error; Total population - SUMMARY INDICATORS - Old-age dependency ratio,Total; Estimate; Total population - SUMMARY INDICATORS - Child dependency ratio,Total; Margin of Error; Total population - SUMMARY INDICATORS - Child dependency ratio,Male; Estimate; Total population - SUMMARY INDICATORS - Child dependency ratio,Male; Margin of Error; Total population - SUMMARY INDICATORS - Child dependency ratio,Female; Estimate; Total population - SUMMARY INDICATORS - Child dependency ratio,Female; Margin of Error; Total population - SUMMARY INDICATORS - Child dependency ratio,Total; Estimate; Total population - PERCENT IMPUTED - Sex,Total; Margin of Error; Total population - PERCENT IMPUTED - Sex,Male; Estimate; Total population - PERCENT IMPUTED - Sex,Male; Margin of Error; Total population - PERCENT IMPUTED - Sex,Female; Estimate; Total population - PERCENT IMPUTED - Sex,Female; Margin of Error; Total population - PERCENT IMPUTED - Sex,Total; Estimate; Total population - PERCENT IMPUTED - Age,Total; Margin of Error; Total population - PERCENT IMPUTED - Age,Male; Estimate; Total population - PERCENT IMPUTED - Age,Male; Margin of Error; Total population - PERCENT IMPUTED - Age,Female; Estimate; Total population - PERCENT IMPUTED - Age,Female; Margin of Error; Total population - PERCENT IMPUTED - Age
0500000US34001,34001,"Atlantic County, New Jersey",271620,*****,131331,340,140289,340,6.3,0.1,6.7,0.2,5.8,0.2,5.9,0.5,6.7,0.8,5.2,0.8,7.3,0.5,7.3,0.8,7.3,0.8,7.9,0.4,8.1,0.7,7.7,0.5,5.2,0.4,5.6,0.7,4.9,0.5,6.5,0.1,6.4,0.2,6.5,0.1,6.4,0.2,6.1,0.4,6.7,0.1,7.8,0.6,7.5,1.0,8.1,0.8,8.2,0.7,9.0,1.0,7.4,0.9,8.0,0.2,8.1,0.5,7.9,0.2,6.9,0.1,7.0,0.2,6.8,0.1,5.7,0.5,5.8,0.7,5.7,0.7,4.5,0.5,4.4,0.7,4.6,0.7,3.8,0.4,3.5,0.5,4.1,0.6,2.8,0.4,2.7,0.5,3.0,0.6,2.7,0.4,2.7,0.5,2.7,0.5,2.4,0.4,1.7,0.5,3.0,0.6,1.6,0.3,0.7,0.3,2.5,0.5,13.2,0.1,14.0,0.1,12.5,0.2,4.4,0.1,4.5,0.1,4.4,0.2,8.7,0.1,9.2,0.3,8.2,0.1,42.1,0.2,42.7,0.4,41.4,0.3,79.0,0.3,77.8,0.5,80.1,0.4,76.1,0.1,74.9,0.2,77.3,0.2,17.8,0.5,15.6,0.7,19.9,0.7,16.3,0.4,13.7,0.5,18.7,0.7,13.4,0.2,11.3,0.2,15.3,0.3,6.7,0.1,5.1,0.2,8.2,0.2,38.0,0.4,37.4,0.7,38.6,0.7,93.6,0.5,(X),(X),(X),(X),59.4,0.6,(X),(X),(X),(X),21.3,0.5,(X),(X),(X),(X),38.1,0.2,(X),(X),(X),(X),0.3,(X),(X),(X),(X),(X),1.6,(X),(X),(X),(X),(X)
0500000US34003,34003,"Bergen County, New Jersey",904037,*****,438822,355,465215,355,5.7,0.1,6.0,0.1,5.5,0.1,6.3,0.3,6.6,0.4,6.0,0.4,6.5,0.3,6.9,0.4,6.1,0.4,6.3,0.1,6.8,0.1,5.9,0.1,5.6,0.1,5.9,0.1,5.2,0.1,4.6,0.1,4.9,0.1,4.3,0.1,6.1,0.1,6.2,0.1,5.9,0.1,7.5,0.4,7.9,0.6,7.2,0.5,8.7,0.4,8.6,0.6,8.9,0.5,8.6,0.1,8.6,0.1,8.5,0.1,7.6,0.1,7.5,0.1,7.6,0.1,6.6,0.3,6.5,0.4,6.7,0.4,5.3,0.3,5.2,0.4,5.5,0.4,4.0,0.2,3.9,0.3,4.1,0.3,3.2,0.2,2.9,0.3,3.6,0.3,2.9,0.2,2.5,0.2,3.2,0.3,2.4,0.2,1.7,0.3,3.0,0.3,2.2,0.2,1.6,0.2,2.8,0.3,12.8,0.1,13.4,0.1,12.1,0.1,4.1,0.1,4.3,0.1,3.8,0.1,7.8,0.1,8.4,0.1,7.3,0.1,38.8,0.1,40.2,0.1,37.4,0.1,80.3,0.2,79.0,0.2,81.4,0.2,77.5,0.1,76.3,0.1,78.6,0.1,20.0,0.3,17.8,0.4,22.1,0.5,17.7,0.3,15.4,0.3,19.8,0.4,14.6,0.1,12.6,0.1,16.6,0.1,7.4,0.1,5.8,0.1,8.9,0.1,40.8,0.2,39.3,0.4,42.1,0.2,94.3,0.1,(X),(X),(X),(X),59.2,0.1,(X),(X),(X),(X),23.3,0.1,(X),(X),(X),(X),35.9,0.1,(X),(X),(X),(X),0.2,(X),(X),(X),(X),(X),0.8,(X),(X),(X),(X),(X)
0500000US34005,34005,"Burlington County, New Jersey",450627,*****,221932,456,228695,456,5.9,0.1,5.7,0.2,6.1,0.2,6.0,0.4,6.1,0.5,6.0,0.5,6.8,0.4,7.2,0.5,6.5,0.5,6.8,0.2,7.4,0.2,6.2,0.3,6.1,0.2,6.8,0.2,5.5,0.3,6.3,0.3,6.7,0.3,5.9,0.3,6.6,0.1,6.9,0.3,6.3,0.1,7.8,0.5,7.6,0.7,7.9,0.7,8.6,0.5,8.8,0.6,8.4,0.6,8.4,0.1,8.5,0.1,8.3,0.2,7.1,0.1,7.0,0.1,7.2,0.1,5.6,0.3,5.3,0.5,5.9,0.4,5.2,0.3,5.3,0.5,5.1,0.4,3.6,0.3,3.2,0.3,4.0,0.4,2.9,0.3,2.9,0.3,2.9,0.3,2.5,0.2,2.0,0.3,2.9,0.4,2.1,0.3,1.6,0.3,2.6,0.4,1.7,0.2,1.1,0.3,2.2,0.3,12.8,0.1,13.2,0.1,12.4,0.1,4.3,0.1,4.6,0.1,4.1,0.1,8.6,0.3,9.6,0.3,7.6,0.3,42.2,0.1,44.2,0.1,40.2,0.2,79.6,0.2,79.5,0.4,79.8,0.4,76.9,0.1,76.5,0.2,77.3,0.2,17.9,0.3,16.0,0.5,19.8,0.4,15.8,0.3,14.1,0.4,17.5,0.4,12.7,0.1,10.8,0.1,14.7,0.1,6.2,0.1,4.7,0.1,7.7,0.1,38.6,0.4,37.3,0.4,39.8,0.4,97.0,0.4,(X),(X),(X),(X),55.8,0.2,(X),(X),(X),(X),19.9,0.1,(X),(X),(X),(X),35.9,0.1,(X),(X),(X),(X),0.2,(X),(X),(X),(X),(X),0.5,(X),(X),(X),(X),(X)
0500000US34007,34007,"Camden County, New Jersey",517001,*****,250593,350,266408,350,6.5,0.1,6.8,0.1,6.2,0.1,6.2,0.4,6.7,0.6,5.7,0.5,7.6,0.4,7.9,0.6,7.3,0.5,7.4,0.1,7.8,0.2,7.0,0.1,6.6,0.1,7.0,0.1,6.2,0.1,6.4,0.1,6.5,0.1,6.2,0.1,6.2,0.1,6.4,0.1,6.1,0.1,7.5,0.4,7.9,0.6,7.1,0.7,7.8,0.4,7.3,0.6,8.2,0.7,8.1,0.1,8.1,0.1,8.0,0.1,7.1,0.1,7.0,0.1,7.2,0.1,6.1,0.3,5.7,0.4,6.4,0.4,4.5,0.3,4.6,0.4,4.4,0.4,3.3,0.3,2.9,0.3,3.6,0.4,2.7,0.3,2.6,0.4,2.7,0.4,2.1,0.3,1.9,0.3,2.4,0.4,2.3,0.2,1.8,0.3,2.8,0.3,1.7,0.2,1.0,0.2,2.4,0.3,13.8,0.1,14.6,0.1,13.0,0.1,4.8,0.1,5.0,0.1,4.5,0.1,9.3,0.1,9.8,0.1,8.7,0.1,41.9,0.1,43.0,0.1,40.8,0.1,78.0,0.2,76.9,0.4,79.0,0.3,75.0,0.1,73.6,0.1,76.3,0.1,16.6,0.3,14.8,0.4,18.3,0.4,14.5,0.2,12.6,0.4,16.3,0.3,12.1,0.1,10.2,0.1,13.9,0.1,6.2,0.1,4.7,0.2,7.6,0.1,37.0,0.3,35.4,0.1,38.8,0.4,94.1,0.3,(X),(X),(X),(X),59.1,0.1,(X),(X),(X),(X),19.3,0.1,(X),(X),(X),(X),39.8,0.1,(X),(X),(X),(X),0.4,(X),(X),(X),(X),(X),1.3,(X),(X),(X),(X),(X)
0500000US34009,34009,"Cape May County, New Jersey",97724,*****,46370,714,51354,714,4.2,0.6,4.1,0.4,4.3,1.0,5.7,1.1,5.7,1.5,5.8,1.6,6.1,1.1,6.1,1.2,6.1,1.6,5.9,0.5,7.1,0.4,4.9,0.8,5.2,0.4,5.5,0.3,5.0,0.7,6.0,0.5,6.1,0.9,5.9,0.7,5.8,0.9,5.9,1.2,5.7,0.9,5.4,1.0,6.0,1.5,4.9,1.4,7.9,0.9,7.8,1.3,8.0,1.4,7.4,0.2,7.7,0.5,7.2,0.2,7.4,0.4,7.6,0.4,7.2,0.5,5.7,0.8,5.2,1.2,6.2,1.1,6.7,0.7,6.8,1.1,6.5,1.1,5.3,0.8,4.8,1.0,5.8,1.0,4.5,0.8,4.9,1.2,4.0,0.9,4.6,0.8,4.1,0.9,5.0,1.1,3.1,0.8,2.0,0.7,4.2,1.2,2.9,0.7,2.6,0.8,3.2,1.2,11.8,0.6,11.8,1.0,11.8,1.1,4.1,0.3,4.6,0.4,3.6,0.4,7.1,0.3,8.0,0.3,6.3,0.4,36.3,0.6,38.4,1.0,34.5,0.8,82.3,0.5,81.8,1.3,82.8,1.0,79.9,*****,79.4,1.0,80.3,0.9,27.1,0.8,25.2,1.3,28.9,1.2,24.2,0.8,22.1,1.3,26.1,1.0,20.5,0.4,18.4,0.7,22.4,0.6,10.7,0.3,8.7,0.3,12.5,0.4,43.6,0.4,42.2,1.0,44.7,0.6,90.3,2.6,(X),(X),(X),(X),68.3,1.2,(X),(X),(X),(X),34.5,0.9,(X),(X),(X),(X),33.8,0.2,(X),(X),(X),(X),0.3,(X),(X),(X),(X),(X),0.7,(X),(X),(X),(X),(X)
0500000US34011,34011,"Cumberland County, New Jersey",154823,*****,79949,279,74874,279,6.9,0.1,6.7,0.2,7.1,0.2,7.4,0.7,7.4,1.0,7.4,1.2,5.4,0.7,5.3,0.9,5.5,1.2,7.0,0.6,7.3,0.9,6.7,0.5,6.6,0.4,6.9,0.6,6.2,0.5,7.7,0.5,8.5,0.9,6.9,0.2,7.2,0.3,7.6,0.6,6.6,0.2,8.4,1.0,9.7,1.6,7.1,1.0,8.4,0.9,9.7,1.5,7.0,1.0,7.3,0.5,6.8,1.0,7.8,0.5,5.2,0.3,4.9,0.4,5.5,0.5,6.3,0.7,6.2,0.8,6.4,0.9,4.0,0.7,4.0,0.9,4.0,0.9,3.5,0.5,2.5,0.5,4.6,0.7,2.6,0.4,2.2,0.5,3.1,0.7,2.5,0.5,2.0,0.5,3.1,0.9,2.1,0.5,1.4,0.6,2.9,0.8,1.5,0.4,0.8,0.4,2.1,0.8,12.8,0.2,12.7,0.3,12.9,0.2,4.4,0.1,4.5,0.1,4.3,0.1,9.2,0.5,9.7,1.0,8.6,0.2,45.3,0.6,49.8,1.1,40.5,0.4,79.1,0.4,79.6,0.6,78.6,0.6,75.9,0.2,76.1,0.3,75.7,0.2,16.2,0.7,12.9,0.8,19.8,0.9,14.7,0.6,11.1,0.8,18.6,0.9,12.2,0.4,8.9,0.6,15.8,0.6,6.1,0.3,4.2,0.5,8.1,0.3,36.0,0.4,35.1,0.5,37.5,0.7,106.8,0.8,(X),(X),(X),(X),57.1,1.0,(X),(X),(X),(X),19.2,0.8,(X),(X),(X),(X),37.9,0.4,(X),(X),(X),(X),0.1,(X),(X),(X),(X),(X),0.6,(X),(X),(X),(X),(X)
0500000US34013,34013,"Essex County, New Jersey",786147,*****,377649,369,408498,369,7.4,0.1,7.9,0.1,6.9,0.1,7.2,0.4,7.6,0.5,6.8,0.5,7.0,0.4,7.5,0.5,6.5,0.5,7.1,0.1,7.4,0.1,6.8,0.1,6.6,0.1,6.9,0.1,6.2,0.1,6.5,0.1,6.9,0.1,6.1,0.1,6.7,0.1,6.7,0.1,6.7,0.1,7.5,0.4,7.7,0.5,7.4,0.5,7.8,0.4,7.7,0.5,7.9,0.5,7.7,0.1,7.7,0.1,7.7,0.1,6.7,0.1,6.5,0.1,6.8,0.1,5.9,0.3,5.7,0.4,6.2,0.4,4.3,0.3,4.2,0.4,4.5,0.4,3.3,0.2,2.8,0.3,3.8,0.3,2.7,0.2,2.7,0.3,2.7,0.3,2.2,0.2,1.7,0.2,2.7,0.3,1.7,0.2,1.4,0.2,2.0,0.3,1.6,0.2,1.0,0.2,2.2,0.3,14.2,0.1,15.1,0.1,13.3,0.1,4.4,0.1,4.6,0.1,4.3,0.1,9.3,0.1,9.8,0.1,8.8,0.1,42.2,0.1,43.4,0.1,41.1,0.1,77.0,0.2,75.6,0.3,78.3,0.2,74.0,0.1,72.4,0.1,75.4,0.1,15.9,0.3,13.7,0.4,17.9,0.4,14.0,0.2,11.9,0.3,16.0,0.4,11.6,0.1,9.6,0.1,13.4,0.1,5.6,0.1,4.1,0.1,6.9,0.1,36.0,0.2,34.3,0.2,37.7,0.3,92.4,0.2,(X),(X),(X),(X),60.2,0.2,(X),(X),(X),(X),18.5,0.1,(X),(X),(X),(X),41.7,0.1,(X),(X),(X),(X),0.3,(X),(X),(X),(X),(X),1.5,(X),(X),(X),(X),(X)
0500000US34015,34015,"Gloucester County, New Jersey",282031,*****,137558,586,144473,586,5.6,0.1,5.8,0.2,5.4,0.2,6.3,0.5,6.3,0.7,6.3,0.7,6.8,0.5,7.4,0.7,6.2,0.7,7.7,0.3,8.4,0.5,7.0,0.5,7.4,0.4,7.6,0.5,7.2,0.5,6.7,0.4,6.8,0.6,6.5,0.6,6.2,0.3,6.5,0.3,5.9,0.4,7.0,0.6,6.6,0.8,7.3,0.7,8.9,0.6,8.5,0.7,9.3,0.7,8.3,0.1,8.6,0.3,8.1,0.1,7.2,0.2,7.0,0.2,7.3,0.2,6.2,0.5,6.2,0.6,6.2,0.6,4.2,0.4,4.3,0.5,4.1,0.6,3.5,0.4,3.6,0.5,3.4,0.5,2.8,0.3,2.2,0.3,3.3,0.4,2.2,0.3,1.7,0.4,2.6,0.5,2.0,0.3,1.6,0.4,2.3,0.4,1.2,0.3,0.8,0.3,1.6,0.4,13.1,0.1,13.7,0.2,12.5,0.1,4.5,0.1,5.1,0.3,4.0,0.2,10.6,0.4,10.9,0.6,10.3,0.6,43.8,0.2,44.5,0.4,43.2,0.3,79.7,0.3,78.5,0.5,80.7,0.4,76.8,*****,75.4,0.3,78.1,0.3,15.8,0.5,14.2,0.6,17.3,0.6,14.2,0.4,12.7,0.6,15.7,0.5,11.6,0.3,9.9,0.3,13.2,0.3,5.4,0.2,4.2,0.2,6.5,0.3,37.5,0.4,36.1,0.4,38.8,0.4,95.2,0.8,(X),(X),(X),(X),53.3,0.6,(X),(X),(X),(X),17.7,0.5,(X),(X),(X),(X),35.6,0.1,(X),(X),(X),(X),0.2,(X),(X),(X),(X),(X),0.7,(X),(X),(X),(X),(X)
